{
  "schema_version": 1,
  "transaction_id": "TX-K6-Q00-FIFTH-2-3",
  "dry_run": true,
  "claim_id": "n11-k6-q00-fifth-base-reduction",
  "expected_current_transition_id": "T-K6-Q00-FIFTH-1-2",
  "from_gate": 2,
  "to_gate": 3,
  "actor": "openai-gpt-5.6-thinking",
  "reason": "Link the independently reproduced fifth-base reduction evidence.",
  "source_revision": "4173574f32991d14c3557e4ad2f9cebf007aceb6",
  "evidence_ids": [
    "E-K6-Q00-FIFTH-BASE"
  ],
  "operations": [
    {
      "operation": "update",
      "path": "cruthunas/evidence.json"
    },
    {
      "operation": "update",
      "path": "cruthunas/transitions.json"
    },
    {
      "operation": "update",
      "path": "cruthunas/ledger.json"
    }
  ],
  "status": "READY",
  "blocking_conditions": []
}
