{
  "schema_version": 1,
  "transaction_id": "TX-K6-Q00-2-3",
  "dry_run": true,
  "claim_id": "n11-k6-q00-trim-unsat",
  "expected_current_transition_id": "T-K6-Q00-1-2",
  "from_gate": 2,
  "to_gate": 3,
  "actor": "openai-gpt-5.6-thinking",
  "reason": "Link the typed q00 UNSAT certificate evidence without promoting the trim to a legal theorem result.",
  "source_revision": "1849ef7ce8d54a3bd4c15362f84b0496ace5fced",
  "evidence_ids": [
    "E-K6-Q00-UNSAT"
  ],
  "operations": [
    {
      "operation": "update",
      "path": "cruthunas/evidence.json"
    },
    {
      "operation": "update",
      "path": "cruthunas/transitions.json"
    },
    {
      "operation": "update",
      "path": "cruthunas/ledger.json"
    }
  ],
  "status": "READY",
  "blocking_conditions": []
}
