{
  "schema_version": 1,
  "transaction_id": "TX-K6-Q00-FIVE-BASE-2-3",
  "dry_run": true,
  "claim_id": "n11-k6-q00-five-base-reduction",
  "expected_current_transition_id": "T-K6-Q00-FIVE-BASE-1-2",
  "from_gate": 2,
  "to_gate": 3,
  "actor": "openai-gpt-5.6-thinking",
  "reason": "Link independently reproduced Python and JavaScript five-base reduction evidence.",
  "source_revision": "014378581f5a24ad8b7cc9748411c0ed0aad9105",
  "evidence_ids": [
    "E-K6-Q00-FIVE-BASE"
  ],
  "operations": [
    {
      "operation": "update",
      "path": "cruthunas/evidence.json"
    },
    {
      "operation": "update",
      "path": "cruthunas/transitions.json"
    },
    {
      "operation": "update",
      "path": "cruthunas/ledger.json"
    }
  ],
  "status": "READY",
  "blocking_conditions": []
}
